{
  "schemaVersion": "1.0.0",
  "intakeId": "7e2b6a10-4c1e-4f8a-9d3b-21c8a0f5b901",
  "receivedAt": "2026-09-11T10:00:00Z",
  "sourceOwner": "owner-1c-test",
  "classification": "RESTRICTED",
  "gitPolicy": "DO_NOT_COMMIT_PAYLOAD",
  "intendedUse": ["CATALOG", "EXTENSION_AUDIT"],
  "correlationId": "dump-intake-demo-0001",
  "notes": "Synthetic manifest. Real DT/CF files are not attached.",
  "period": {
    "start": "2026-08-01",
    "end": "2026-08-31"
  },
  "sanitization": {
    "status": "PARTIAL",
    "maskedFields": ["counterpartyInn", "employeeName"]
  },
  "bases": [
    {
      "baseCode": "UT_CENTRAL",
      "contour": "UT_CENTRAL",
      "displayName": "Demo central UT",
      "platformVersion": "8.3.24",
      "configurationName": "УправлениеТорговлей",
      "configurationVersion": "11.5.demo",
      "supportMode": "PARTIAL",
      "unknownReason": null,
      "status": "UNVERIFIED"
    }
  ],
  "artifacts": [
    {
      "artifactId": "0c3d91e2-8a77-4b2f-a1d0-6e4f9c8b7012",
      "fileName": "ut-central.demo.dt",
      "mediaType": "application/octet-stream",
      "sha256": "aaaaaaaaaaaaaaaaaaaaaaaaaaaaaaaaaaaaaaaaaaaaaaaaaaaaaaaaaaaaaaaa",
      "sizeBytes": 1048576,
      "kind": "DT",
      "baseCode": "UT_CENTRAL"
    }
  ]
}
